{
  "schemaVersion": "layout-recipe.v1",
  "layoutId": "table-test-result-status.v1",
  "layoutVersion": "1.1.0",
  "supports": {
    "pageTypes": ["TABLE"],
    "pagePurposes": ["TEST"],
    "contentTypes": ["TABULAR"],
    "imageRoles": [],
    "assetKinds": [],
    "tableKinds": ["TEST_RESULT"],
    "assetCount": { "min": 0, "max": 0 }
  },
  "slots": {
    "title": { "gridColumn": 1, "gridSpan": 12, "topIn": 0.4, "heightIn": 0.7 },
    "table": { "gridColumn": 1, "gridSpan": 12, "topIn": 1.32, "heightIn": 4.65 },
    "conclusion": { "gridColumn": 2, "gridSpan": 10, "topIn": 6.12, "heightIn": 0.68 },
    "footer": { "gridColumn": 1, "gridSpan": 12, "topIn": 6.85, "heightIn": 0.25 }
  },
  "constraints": {
    "titleMaxLines": 1,
    "bodyMaxChars": 700,
    "captionMaxChars": 0,
    "imageFit": "CONTAIN",
    "cropAllowed": false,
    "minImageAreaRatio": 0
  },
  "fallbacks": ["table-generic-compact.v1"]
}
