{
  "schemaVersion": "layout-recipe.v1",
  "layoutId": "cover-centered.v1",
  "layoutVersion": "1.0.0",
  "supports": {
    "pageTypes": ["COVER"],
    "pagePurposes": ["BACKGROUND"],
    "contentTypes": ["NARRATIVE"],
    "imageRoles": [],
    "assetKinds": [],
    "tableKinds": [],
    "assetCount": { "min": 0, "max": 0 }
  },
  "slots": {
    "title": { "gridColumn": 2, "gridSpan": 10, "topIn": 1.45, "heightIn": 1.6 },
    "subtitle": { "gridColumn": 2, "gridSpan": 10, "topIn": 3.18, "heightIn": 1.0 },
    "metadata": { "gridColumn": 3, "gridSpan": 8, "topIn": 4.35, "heightIn": 1.25 },
    "footer": { "gridColumn": 3, "gridSpan": 8, "topIn": 6.65, "heightIn": 0.35 }
  },
  "constraints": {
    "titleMaxLines": 2,
    "bodyMaxChars": 160,
    "captionMaxChars": 0,
    "imageFit": "CONTAIN",
    "cropAllowed": false,
    "minImageAreaRatio": 0
  },
  "fallbacks": []
}
