{
  "schemaVersion": "layout-recipe.v1",
  "layoutId": "image-result-chart-with-finding.v1",
  "layoutVersion": "1.0.0",
  "supports": {
    "pageTypes": ["IMAGE"],
    "pagePurposes": ["RESULT", "TEST"],
    "contentTypes": ["METRICS", "FIGURE"],
    "imageRoles": ["PROOF"],
    "assetKinds": ["CHART", "SCREENSHOT"],
    "tableKinds": [],
    "assetCount": { "min": 1, "max": 1 }
  },
  "slots": {
    "title": { "gridColumn": 1, "gridSpan": 12, "topIn": 0.4, "heightIn": 0.7 },
    "image": { "gridColumn": 1, "gridSpan": 9, "topIn": 1.32, "heightIn": 4.55 },
    "conclusion": { "gridColumn": 10, "gridSpan": 3, "topIn": 1.8, "heightIn": 2.1 },
    "caption": { "gridColumn": 1, "gridSpan": 12, "topIn": 6.02, "heightIn": 0.75 },
    "footer": { "gridColumn": 1, "gridSpan": 12, "topIn": 6.9, "heightIn": 0.2 }
  },
  "constraints": {
    "titleMaxLines": 1,
    "bodyMaxChars": 160,
    "captionMaxChars": 90,
    "imageFit": "CONTAIN",
    "cropAllowed": false,
    "minImageAreaRatio": 0.55
  },
  "fallbacks": ["image-proof-screenshot-wide.v1"]
}
