{
  "schemaVersion": "layout-recipe.v1",
  "layoutId": "summary-outcome-chain.v1",
  "layoutVersion": "1.0.0",
  "supports": {
    "pageTypes": ["SUMMARY"],
    "pagePurposes": ["SUMMARY"],
    "contentTypes": ["NARRATIVE", "KEY_POINTS", "PROCESS", "COMPARISON", "ARCHITECTURE", "METRICS", "MIXED"],
    "imageRoles": [], "assetKinds": [], "tableKinds": [],
    "assetCount": { "min": 0, "max": 0 }
  },
  "slots": {
    "title": { "gridColumn": 1, "gridSpan": 12, "topIn": 0.4, "heightIn": 0.7 },
    "keyPoints": { "gridColumn": 1, "gridSpan": 12, "topIn": 1.48, "heightIn": 3.92 },
    "conclusion": { "gridColumn": 2, "gridSpan": 10, "topIn": 5.58, "heightIn": 0.98 },
    "footer": { "gridColumn": 1, "gridSpan": 12, "topIn": 6.85, "heightIn": 0.25 }
  },
  "constraints": {
    "titleMaxLines": 1, "bodyMaxChars": 420, "captionMaxChars": 0,
    "imageFit": "CONTAIN", "cropAllowed": false, "minImageAreaRatio": 0,
    "allowedContainedTextComponents": ["keyPointCard", "summaryCard"]
  },
  "fallbacks": ["summary-achievements.v1"]
}
