{
  "schemaVersion": "layout-recipe.v1",
  "layoutId": "table-generic-compact.v1",
  "layoutVersion": "1.0.0",
  "supports": {
    "pageTypes": ["TABLE"],
    "pagePurposes": ["BACKGROUND", "PROBLEM", "METHOD", "DESIGN", "DATABASE", "IMPLEMENTATION", "RESULT", "TEST", "SUMMARY"],
    "contentTypes": ["TABULAR"],
    "imageRoles": [],
    "assetKinds": [],
    "tableKinds": ["GENERIC", "ENTITY_PURPOSE", "TEST_RESULT", "METRIC_COMPARISON", "FEATURE_MATRIX"],
    "assetCount": { "min": 0, "max": 0 }
  },
  "slots": {
    "title": { "gridColumn": 1, "gridSpan": 12, "topIn": 0.4, "heightIn": 0.7 },
    "table": { "gridColumn": 1, "gridSpan": 12, "topIn": 1.4, "heightIn": 4.55 },
    "conclusion": { "gridColumn": 2, "gridSpan": 10, "topIn": 6.12, "heightIn": 0.68 },
    "footer": { "gridColumn": 1, "gridSpan": 12, "topIn": 6.9, "heightIn": 0.2 }
  },
  "constraints": {
    "titleMaxLines": 1,
    "bodyMaxChars": 380,
    "captionMaxChars": 0,
    "imageFit": "CONTAIN",
    "cropAllowed": false,
    "minImageAreaRatio": 0
  },
  "fallbacks": []
}
