{
  "schemaVersion": "layout-recipe.v1",
  "layoutId": "summary-future.v1",
  "layoutVersion": "1.0.0",
  "supports": {
    "pageTypes": ["SUMMARY"],
    "pagePurposes": ["SUMMARY"],
    "contentTypes": ["KEY_POINTS", "NARRATIVE"],
    "imageRoles": [],
    "assetKinds": [],
    "tableKinds": [],
    "assetCount": { "min": 0, "max": 0 }
  },
  "slots": {
    "title": { "gridColumn": 1, "gridSpan": 12, "topIn": 0.4, "heightIn": 0.7 },
    "keyPoints": { "gridColumn": 1, "gridSpan": 8, "topIn": 1.55, "heightIn": 4.65 },
    "conclusion": { "gridColumn": 9, "gridSpan": 4, "topIn": 1.9, "heightIn": 3.7 },
    "footer": { "gridColumn": 1, "gridSpan": 12, "topIn": 6.85, "heightIn": 0.25 }
  },
  "constraints": {
    "titleMaxLines": 1,
    "bodyMaxChars": 240,
    "captionMaxChars": 0,
    "imageFit": "CONTAIN",
    "cropAllowed": false,
    "minImageAreaRatio": 0,
    "allowedContainedTextComponents": ["keyPointCard", "summaryCard"]
  },
  "fallbacks": []
}
