{
  "schemaVersion": "layout-recipe.v1",
  "layoutId": "thanks-centered.v1",
  "layoutVersion": "1.0.0",
  "supports": {
    "pageTypes": ["THANKS"],
    "pagePurposes": ["SUMMARY"],
    "contentTypes": ["NARRATIVE"],
    "imageRoles": [],
    "assetKinds": [],
    "tableKinds": [],
    "assetCount": { "min": 0, "max": 0 }
  },
  "slots": {
    "title": { "gridColumn": 2, "gridSpan": 10, "topIn": 2.3, "heightIn": 1.1 },
    "body": { "gridColumn": 3, "gridSpan": 8, "topIn": 3.8, "heightIn": 0.8 },
    "footer": { "gridColumn": 4, "gridSpan": 6, "topIn": 5.35, "heightIn": 0.5 }
  },
  "constraints": {
    "titleMaxLines": 1,
    "bodyMaxChars": 100,
    "captionMaxChars": 0,
    "imageFit": "CONTAIN",
    "cropAllowed": false,
    "minImageAreaRatio": 0
  },
  "fallbacks": []
}
